{
  "schemaVersion": "1.0",
  "storage": "postgres",
  "dataMode": "import",
  "tenantId": "tenant-demo",
  "sourceInstanceId": "cmdb-import",
  "namespace": "enterprise-assets",
  "entityId": "11111111-1111-4111-8111-111111111111",
  "after": null,
  "limit": 10,
  "items": [
    {
      "schemaVersion": "1.0",
      "storage": "postgres",
      "dataMode": "import",
      "tenantId": "tenant-demo",
      "actor": "operator",
      "sourceInstanceId": "cmdb-import",
      "namespace": "enterprise-assets",
      "command": {
        "requestId": "55555555-5555-4555-8555-555555555555",
        "externalId": "cmdb-asset-1",
        "expectedSnapshotId": "92222222-2222-4222-8222-222222222222",
        "previousEntityId": "11111111-1111-4111-8111-111111111111",
        "expectedPreviousVersion": 4,
        "targetEntityId": "22222222-2222-4222-8222-222222222222",
        "expectedTargetVersion": 2,
        "targetIdentity": {
          "id": "33333333-3333-4333-8333-333333333333",
          "namespace": "enterprise-assets",
          "value": "44444444-4444-4444-8444-444444444444",
          "version": 1
        },
        "observedAt": "2026-09-26T01:00:00Z",
        "values": {
          "owner": "Corrected fixture owner"
        },
        "reason": "Verified source UUID; retain original history"
      },
      "previous": {
        "tenantId": "tenant-demo",
        "entityId": "11111111-1111-4111-8111-111111111111",
        "sourceInstanceId": "cmdb-import",
        "externalId": "cmdb-asset-1",
        "identity": {
          "id": "42b6ec26-6ced-431e-90ea-559fe0c609d2",
          "namespace": "enterprise-assets",
          "value": "a2e021a0-96aa-4fdd-b5cf-5a6b9113d690",
          "version": 1
        },
        "observedAt": "2026-09-26T00:00:00Z",
        "ingestedAt": "2026-09-26T00:00:01Z",
        "expiresAt": "2026-10-03T00:00:00Z",
        "present": true,
        "snapshotId": "92222222-2222-4222-8222-222222222222"
      },
      "snapshot": {
        "schemaVersion": "1.0",
        "storage": "postgres",
        "dataMode": "import",
        "tenantId": "tenant-demo",
        "actor": "operator",
        "sourceInstanceId": "cmdb-import",
        "namespace": "enterprise-assets",
        "input": {
          "requestId": "55555555-5555-4555-8555-555555555555",
          "observedAt": "2026-09-26T01:00:00Z",
          "complete": false,
          "records": [
            {
              "externalId": "cmdb-asset-1",
              "assetUuid": "44444444-4444-4444-8444-444444444444",
              "values": {
                "owner": "Corrected fixture owner"
              }
            }
          ]
        },
        "ingestedAt": "2026-09-26T01:00:01Z",
        "mappingDigest": "sha256:c8c61f0ddd773a03128464f25babc956e850a46e52baaf39568f03816fd1a4bf",
        "engine": "registered-cmdb-snapshot-v1",
        "markedAbsent": 0,
        "resolved": [
          {
            "externalId": "cmdb-asset-1",
            "entityId": "22222222-2222-4222-8222-222222222222",
            "identity": {
              "id": "33333333-3333-4333-8333-333333333333",
              "namespace": "enterprise-assets",
              "value": "44444444-4444-4444-8444-444444444444",
              "version": 1
            },
            "reviewId": "66666666-6666-4666-8666-666666666666",
            "entityVersion": 3
          }
        ]
      },
      "previousEntityVersionAfter": 5
    }
  ],
  "nextCursor": null
}
